{
  "dbName": "entries",
  "collectionNameGuest": "guest",
  "collectionNameStaff": "staff",
  "collectionNameStaffShift": "shift",
  "collectionNameRoom": "room",
  "collectionNameShiftRoom": "shift-room",
  "uri": "URL",
  "uriOptions": "retryWrites=true&w=majority",
  "protocol": "mongodb+srv",
  "credentials": {
    "user": "Username",
    "pwd": "Password"
  }
}
